{
  "archetype": "service",
  "company": "成都启元财税服务有限公司",
  "today": "2026-09-17",
  "horizon": 21,
  "workday": {
    "restWeekdays": [
      0,
      6
    ]
  },
  "labor": {
    "hourly": 40,
    "overtimeMul": 1.3
  },
  "sources": [
    {
      "id": "crm",
      "name": "客户与服务单",
      "mode": "direct",
      "lastSync": "2026-09-17 07:30",
      "rows": 11
    },
    {
      "id": "tax",
      "name": "申报日历",
      "mode": "direct",
      "lastSync": "2026-09-17 07:30",
      "rows": 4
    },
    {
      "id": "hr",
      "name": "小组排班",
      "mode": "import",
      "lastSync": "2026-09-16 18:00",
      "rows": 4
    }
  ],
  "lines": [
    {
      "id": "G1",
      "name": "资料组",
      "capHoursPerDay": 8,
      "crew": 3,
      "ops": [
        "资料收集"
      ]
    },
    {
      "id": "G2",
      "name": "账务一组",
      "capHoursPerDay": 8,
      "crew": 5,
      "ops": [
        "凭证录入",
        "账务处理"
      ]
    },
    {
      "id": "G3",
      "name": "账务二组",
      "capHoursPerDay": 8,
      "crew": 4,
      "ops": [
        "凭证录入",
        "账务处理"
      ],
      "eff": 0.9
    },
    {
      "id": "G4",
      "name": "税务组",
      "capHoursPerDay": 8,
      "crew": 3,
      "ops": [
        "申报",
        "归档"
      ]
    }
  ],
  "products": [
    {
      "id": "V01",
      "name": "小规模纳税人月度账务",
      "unit": "工时",
      "route": [
        {
          "op": "资料收集",
          "line": "G1",
          "hoursPerUnit": 0.15,
          "setupHours": 0.2
        },
        {
          "op": "凭证录入",
          "line": "G3",
          "hoursPerUnit": 0.35,
          "setupHours": 0.2
        },
        {
          "op": "账务处理",
          "line": "G3",
          "hoursPerUnit": 0.3,
          "setupHours": 0.2
        },
        {
          "op": "申报",
          "line": "G4",
          "hoursPerUnit": 0.15,
          "setupHours": 0.2
        },
        {
          "op": "归档",
          "line": "G4",
          "hoursPerUnit": 0.05,
          "setupHours": 0
        }
      ],
      "bom": [
        {
          "material": "Q01",
          "qtyPer": 1,
          "per": "order"
        },
        {
          "material": "Q02",
          "qtyPer": 1,
          "per": "order",
          "op": "申报"
        }
      ]
    },
    {
      "id": "V02",
      "name": "一般纳税人月度账务",
      "unit": "工时",
      "route": [
        {
          "op": "资料收集",
          "line": "G1",
          "hoursPerUnit": 0.2,
          "setupHours": 0.2
        },
        {
          "op": "凭证录入",
          "line": "G2",
          "hoursPerUnit": 0.35,
          "setupHours": 0.3
        },
        {
          "op": "账务处理",
          "line": "G2",
          "hoursPerUnit": 0.3,
          "setupHours": 0.3
        },
        {
          "op": "申报",
          "line": "G4",
          "hoursPerUnit": 0.1,
          "setupHours": 0.2
        },
        {
          "op": "归档",
          "line": "G4",
          "hoursPerUnit": 0.05,
          "setupHours": 0
        }
      ],
      "bom": [
        {
          "material": "Q01",
          "qtyPer": 1,
          "per": "order"
        },
        {
          "material": "Q02",
          "qtyPer": 1,
          "per": "order",
          "op": "申报"
        },
        {
          "material": "Q03",
          "qtyPer": 0.05,
          "op": "账务处理"
        }
      ]
    },
    {
      "id": "V03",
      "name": "年度汇算清缴",
      "unit": "工时",
      "route": [
        {
          "op": "资料收集",
          "line": "G1",
          "hoursPerUnit": 0.2,
          "setupHours": 0.5
        },
        {
          "op": "账务处理",
          "line": "G2",
          "hoursPerUnit": 0.6,
          "setupHours": 0.5
        },
        {
          "op": "申报",
          "line": "G4",
          "hoursPerUnit": 0.15,
          "setupHours": 0.3
        },
        {
          "op": "归档",
          "line": "G4",
          "hoursPerUnit": 0.05,
          "setupHours": 0
        }
      ],
      "bom": [
        {
          "material": "Q01",
          "qtyPer": 1,
          "per": "order"
        },
        {
          "material": "Q02",
          "qtyPer": 1,
          "per": "order",
          "op": "申报"
        },
        {
          "material": "Q04",
          "qtyPer": 1,
          "per": "order",
          "op": "账务处理"
        }
      ]
    }
  ],
  "materials": [
    {
      "id": "Q01",
      "name": "客户原始票据（已交齐）",
      "spec": "按服务单计",
      "unit": "份",
      "stock": 5,
      "safety": 0,
      "onOrder": [
        {
          "po": "CL-2609-044",
          "qty": 2,
          "eta": "2026-09-21"
        }
      ],
      "leadDays": 3,
      "moq": 1,
      "pack": 1,
      "unitCost": 0,
      "supplier": "客户对接",
      "avgDailyUse": 1
    },
    {
      "id": "Q02",
      "name": "申报授权与 CA 证书",
      "spec": "有效期内",
      "unit": "份",
      "stock": 10,
      "safety": 0,
      "onOrder": [],
      "leadDays": 2,
      "moq": 1,
      "pack": 1,
      "unitCost": 0,
      "supplier": "客户对接",
      "avgDailyUse": 1
    },
    {
      "id": "Q03",
      "name": "外聘审核工时",
      "spec": "注册会计师",
      "unit": "人天",
      "stock": 4,
      "safety": 1,
      "onOrder": [],
      "leadDays": 5,
      "moq": 1,
      "pack": 1,
      "unitCost": 1800,
      "supplier": "合作事务所",
      "avgDailyUse": 0.2
    },
    {
      "id": "Q04",
      "name": "汇算底稿模板包",
      "spec": "当年版本",
      "unit": "套",
      "stock": 3,
      "safety": 1,
      "onOrder": [],
      "leadDays": 1,
      "moq": 1,
      "pack": 1,
      "unitCost": 0,
      "supplier": "内部",
      "avgDailyUse": 0.1
    },
    {
      "id": "Q05",
      "name": "财务软件账套授权",
      "spec": "年度授权",
      "unit": "套",
      "stock": 40,
      "safety": 5,
      "onOrder": [],
      "leadDays": 1,
      "moq": 10,
      "pack": 10,
      "unitCost": 680,
      "supplier": "软件服务商",
      "avgDailyUse": 0.2
    }
  ],
  "orders": [
    {
      "id": "SV-2609-0210",
      "customer": "K-311 · 餐饮管理公司",
      "product": "V02",
      "qty": 24,
      "due": "2026-09-19",
      "priority": 1,
      "received": "2026-09-03",
      "progress": {
        "资料收集": 1,
        "凭证录入": 0.5
      }
    },
    {
      "id": "SV-2609-0206",
      "customer": "K-287 · 贸易公司",
      "product": "V02",
      "qty": 20,
      "due": "2026-09-18",
      "priority": 1,
      "received": "2026-09-02",
      "progress": {
        "资料收集": 1,
        "凭证录入": 1,
        "账务处理": 0.6
      }
    },
    {
      "id": "SV-2609-0214",
      "customer": "K-330 · 设计工作室",
      "product": "V01",
      "qty": 8,
      "due": "2026-09-23",
      "priority": 2,
      "received": "2026-09-08",
      "progress": {}
    },
    {
      "id": "SV-2609-0201",
      "customer": "K-256 · 建材经销商",
      "product": "V01",
      "qty": 10,
      "due": "2026-09-17",
      "priority": 2,
      "received": "2026-09-01",
      "progress": {
        "资料收集": 1,
        "凭证录入": 1,
        "账务处理": 1,
        "申报": 1,
        "归档": 1
      }
    },
    {
      "id": "SV-2609-0218",
      "customer": "K-342 · 电商公司",
      "product": "V02",
      "qty": 30,
      "due": "2026-09-25",
      "priority": 1,
      "received": "2026-09-10",
      "progress": {}
    },
    {
      "id": "SV-2609-0219",
      "customer": "K-298 · 培训机构",
      "product": "V03",
      "qty": 36,
      "due": "2026-09-30",
      "priority": 2,
      "received": "2026-09-11",
      "progress": {}
    },
    {
      "id": "SV-2609-0221",
      "customer": "K-351 · 咨询公司",
      "product": "V01",
      "qty": 6,
      "due": "2026-09-24",
      "priority": 3,
      "received": "2026-09-12",
      "progress": {}
    },
    {
      "id": "SV-2609-0223",
      "customer": "K-311 · 餐饮管理公司",
      "product": "V03",
      "qty": 40,
      "due": "2026-10-08",
      "priority": 2,
      "received": "2026-09-14",
      "progress": {}
    },
    {
      "id": "SV-2609-0224",
      "customer": "K-360 · 物流公司",
      "product": "V02",
      "qty": 26,
      "due": "2026-09-28",
      "priority": 2,
      "received": "2026-09-15",
      "progress": {}
    },
    {
      "id": "SV-2609-0225",
      "customer": "K-372 · 医疗器械公司",
      "product": "V01",
      "qty": 9,
      "due": "2026-09-26",
      "priority": 3,
      "received": "2026-09-16",
      "progress": {}
    }
  ],
  "insertPresets": [
    {
      "customer": "K-380 · 新客户 · 软件公司",
      "product": "V02",
      "qty": 22,
      "due": "2026-09-24",
      "note": "上家机构交接，本月申报在即"
    }
  ],
  "overtime": [],
  "log": []
}
